{
  "schema_version": "1.0.0",
  "analysis_run_id": "analysis-run-001",
  "clip_asset_id": "clip-asset-001",
  "canonical_frame_count": "120",
  "coordinate_space": "NORMALIZED_VIDEO",
  "clip_artifact": {
    "artifact_id": "clip-asset-001",
    "kind": "CANONICAL_CLIP",
    "schema_version": "1.0.0",
    "sha256": "aaaaaaaaaaaaaaaaaaaaaaaaaaaaaaaaaaaaaaaaaaaaaaaaaaaaaaaaaaaaaaaa",
    "byte_length": "10485760",
    "content_type": "video/mp4"
  },
  "pose_manifest_artifact": {
    "artifact_id": "pose-manifest-001",
    "kind": "PERSON_POSE_EVIDENCE_MANIFEST",
    "schema_version": "1.0.0",
    "sha256": "eeeeeeeeeeeeeeeeeeeeeeeeeeeeeeeeeeeeeeeeeeeeeeeeeeeeeeeeeeeeeeee",
    "byte_length": "4096",
    "content_type": "application/json"
  },
  "crop_recipe": {
    "namespace": "player-crop/pose-bbox/pad-0.10-v1",
    "bbox_source": "PERSON_POSE_EVIDENCE",
    "decode_alignment": "CANONICAL_FRAME_INDEX",
    "padding_ratio": 0.1,
    "clamp_to_frame": true
  },
  "content_sha256": "bbbbbbbbbbbbbbbbbbbbbbbbbbbbbbbbbbbbbbbbbbbbbbbbbbbbbbbbbbbbbbbb"
}
